<?xml version="1.0"?>
<STYLES xmlns="http://www.donohoedigital.com"
           xmlns:xsi="http://www.w3.org/2001/XMLSchema-instance"
           xsi:schemaLocation="http://www.donohoedigital.com ../../../../../../common/src/main/resources/config/xml-schema/styles.xsd">

	<!-- FONTS: use a system/logical family (SansSerif, Monospaced) - NOT a bundled .ttf.

	     Swing's text views position the caret using FontMetrics from an identity-transform
	     FontRenderContext, but glyphs are painted through the Graphics2D device transform (2x on
	     Retina).  A font loaded via Font.createFont() quantizes its advance widths against the
	     *device* pixel grid, so measured width and painted width disagree and the error accumulates
	     left-to-right - the caret drifts further from the text the longer the text gets.  Bundled
	     Inter at 15pt was ~20px (about 3 characters) off over an 82-char caption, and no point size
	     avoids it: measured drift ran 9-41px across sizes 11-24.  On macOS logical families go
	     through CoreText, which ignores the device transform, so they measure identically at every
	     display scale.  Enforced by StylesFontTest.

	     This fixes macOS only.  Linux and Windows have no CoreText - every font there uses the
	     FreeType scaler and drifts (measured on Linux: SansSerif 26-36px, Monospaced 27-59px).
	     No font choice helps there; DDTextField/DDTextArea now handle it instead by marking their
	     documents "i18n" so Swing paints with TextLayout at the positions it measured (see
	     DDTextField.useTextLayout).  That fix also works for bundled .ttf fonts, so this font rule
	     is now belt-and-braces rather than the only defense.

	     Trade-off accepted: logical families resolve per-platform (Helvetica on macOS, Arial on
	     Windows - metrically compatible; Linux depends on fontconfig, usually DejaVu Sans, which is
	     wider).  Check fixed pixel widths on Linux: NAME_COL_WIDTH in PhotogenEditorPhase and the
	     caption box width passed to OptionTextArea. -->

	<!--        -->
	<!-- COLORS -->
	<!--        -->

	<!-- SHARED COLORS -->
	<color name="ignored" r="0" g="0" b="0"/>
	<color name="lightgrey" r="225" g="225" b="225"/>
	<color name="grey" r="128" g="128" b="128"/>
	<color name="black" r="0" g="0" b="0"/>
	<color name="blue" r="0" g="0" b="255"/>
	<color name="green" r="6" g="125" b="23"/>
	<color name="white" r="255" g="255" b="255"/>
	<color name="yellow" r="255" g="255" b="0"/>
	<color name="red" r="255" g="0" b="0"/>
	<color name="primarywidget.bg" copy="white"/>
	<color name="primarywidget.fg" copy="black"/>
	<color name="primarywidget.error" r="233" g="186" b="186"/>
	<color name="primarylabelborder.fg" r="0" g="0" b="244"/>
	<color name="primaryfont" copy="black"/>
	<color name="text" r="255" g="255" b="255"/>
	<!-- SHARED COLORS -->

	<!-- APP COLORS -->
	<color name="app.panel.bg" r="242" g="242" b="242"/>
	<color name="app.accent" copy="blue"/>
	<!-- APP COLORS -->

	<!-- GUI COLORS -->
	<color name="gui.text.disabled.fg" r="88" g="88" b="88"/>
	<color name="gui.scroll" copy="grey"/>
	<!-- GUI COLORS -->

	<!-- ENGINE FONTS/COLORS -->
	<color name="engine.basepanel" copy="white"/>
	<color name="version.label.fg" copy="primaryfont"/>
	<color name="version.label.bg" default="true"/>
	 <font name="version.label" fontname="SansSerif" pointsize="11"/>

	<!-- internal-frame modal title bars -->
	<color name="modal.title.info.bg" r="140" g="140" b="200"/>
	<color name="modal.title.info.fg" copy="white"/>
	<color name="modal.title.warn.bg" r="210" g="140" b="40"/>
	<color name="modal.title.warn.fg" copy="white"/>
	<color name="modal.title.error.bg" r="180" g="50" b="50"/>
	<color name="modal.title.error.fg" copy="white"/>

	<!-- internal-frame non-modal title bars (was Metal OceanTheme getControl/getPrimaryControl) -->
	<color name="window.title.bg" r="238" g="238" b="238"/>        <!-- unselected -->
	<color name="window.title.active.bg" r="184" g="207" b="229"/> <!-- selected, non-modal -->
	<color name="window.title.fg" copy="black"/>

	<color name="SplashWrong.label.fg" copy="black"/>
	<color name="SplashWrong.label.bg"  r="204" g="204" b="204" a="245"/>
	 <font name="SplashWrong.label" fontname="SansSerif" pointsize="24"/>

	<color name="Splash.label.fg"  copy="black"/>
	<color name="Splash.label.bg" default="true"/>
	 <font name="Splash.label" fontname="SansSerif" pointsize="12"/>
	<color name="Splash.button.fg" default="true"/>
	<color name="Splash.button.bg" default="true"/>
	 <font name="Splash.button" fontname="SansSerif" pointsize="12"/>

	<!-- ENGINE FONTS/COLORS -->
	<color name="Console.error"  r="180" g="50"  b="50"/>
	<color name="Console.system" copy="green"/>
	<color name="Console.link"   r="30"  g="100" b="220"/>
	<color name="Find.match"   r="255" g="235" b="120"/>
	<color name="Find.current" r="255" g="160" b="40"/>
	<color name="Find.border"  r="80"  g="80"  b="80"/>

	 <font name="ConsoleBig.label" fontname="Monospaced" pointsize="18" bold="true"/>
	<color name="ConsoleBig.label.fg" copy="primaryfont"/>
	<color name="ConsoleBig.label.bg" default="true"/>

	 <font name="Console.jtextpane" fontname="Monospaced" pointsize="16"/>

	<color name="ConsoleGreen.label.fg" copy="green"/>
	<color name="ConsoleGreen.label.bg" default="true"/>
	 <font name="ConsoleGreen.label" fontname="Monospaced" pointsize="16"/>
	<color name="ConsoleGreen.button.fg" copy="green"/>
	<color name="ConsoleGreen.button.bg" default="true"/>
	 <font name="ConsoleGreen.button" fontname="Monospaced" pointsize="16"/>
	<color name="ConsoleGreen.checkbox.fg" copy="green"/>
	<color name="ConsoleGreen.checkbox.check" copy="green"/>
	<color name="ConsoleGreen.checkbox.bg" default="true"/>
	 <font name="ConsoleGreen.checkbox" fontname="Monospaced" pointsize="16"/>
	<color name="ConsoleGreen.textfield.fg" copy="green"/>
	<color name="ConsoleGreen.textfield.bg" default="true"/>
	<color name="ConsoleGreen.textfield.error.bg" copy="primarywidget.error"/>
	 <font name="ConsoleGreen.textfield" fontname="Monospaced" pointsize="16"/>
	<color name="ConsoleGreen.combobox.fg" copy="green"/>
	<color name="ConsoleGreen.combobox.bg" copy="white"/>
	<color name="ConsoleGreen.combobox.mouseover.fg" default="true"/>
	<color name="ConsoleGreen.combobox.selection.bg" copy="green"/>
	<color name="ConsoleGreen.combobox.selection.fg" copy="white"/>
	 <font name="ConsoleGreen.combobox" fontname="Monospaced" pointsize="16"/>

	<color name="ConsoleBlue.label.fg" copy="blue"/>
	<color name="ConsoleBlue.label.bg" default="true"/>
	 <font name="ConsoleBlue.label" fontname="Monospaced" pointsize="16"/>
	<color name="ConsoleBlue.button.fg" copy="blue"/>
	<color name="ConsoleBlue.button.bg" default="true"/>
	 <font name="ConsoleBlue.button" fontname="Monospaced" pointsize="16"/>
	<color name="ConsoleBlue.checkbox.fg" copy="blue"/>
	<color name="ConsoleBlue.checkbox.check" copy="blue"/>
	<color name="ConsoleBlue.checkbox.bg" default="true"/>
	 <font name="ConsoleBlue.checkbox" fontname="Monospaced" pointsize="16"/>
	<color name="ConsoleBlue.textfield.fg" copy="blue"/>
	<color name="ConsoleBlue.textfield.bg" default="true"/>
	<color name="ConsoleBlue.textfield.error.bg" copy="primarywidget.error"/>
	 <font name="ConsoleBlue.textfield" fontname="Monospaced" pointsize="16"/>
	<color name="ConsoleBlue.combobox.fg" copy="blue"/>
	<color name="ConsoleBlue.combobox.bg" copy="white"/>
	<color name="ConsoleBlue.combobox.mouseover.fg" default="true"/>
	<color name="ConsoleBlue.combobox.selection.bg" copy="blue"/>
	<color name="ConsoleBlue.combobox.selection.fg" copy="white"/>
	 <font name="ConsoleBlue.combobox" fontname="Monospaced" pointsize="16"/>

	<!-- PHOTOS TABS -->
	<color name="PhotosTabs.tab.fg" r="0" g="0" b="0"/>
	<color name="PhotosTabs.tab.bg" r="204" g="204" b="204" a="150"/>
	 <font name="PhotosTabs.tab" fontname="SansSerif" pointsize="20"/>
	<color name="PhotosTabs.panel.fg" default="true"/>
	<color name="PhotosTabs.panel.bg" default="true"/>
	<!-- PHOTOS TABS -->

	<!-- PhotosHelp -->
	<color name="PhotosHelp.htmlarea.fg" copy="yellow" /><!-- orange r="255" g="127" b="0"-->
	<color name="PhotosHelp.htmlarea.bg" r="125" g="125" b="125"/>
	 <font name="PhotosHelp.htmlarea" fontname="SansSerif" pointsize="16"/>
	<!-- PhotosHelp -->

	<!-- Help -->
	<color name="Help.htmlarea.fg" default="true"/>
	<color name="Help.htmlarea.bg" copy="white"/>
	 <font name="Help.htmlarea" fontname="SansSerif" pointsize="16"/>
	<color name="Help.label.fg" copy="primaryfont"/>
	<color name="Help.label.bg" default="true"/>
	 <font name="Help.label" fontname="SansSerif" pointsize="24"/>
	<color name="Help.button.fg" default="true"/>
	<color name="Help.button.bg" default="true"/>
	 <font name="Help.button" fontname="SansSerif" pointsize="14"/>
	<color name="Help.scrollbar.bg" r="128" g="128" b="128"/>
	<color name="Help.scrollbar.fg" r="64" g="64" b="64"/>
	<color name="Help.scrollbar.focus" r="0" g="0" b="255" a="50"/>
	<color name="Help.scrollpane.bg" r="204" g="204" b="204"/>
	<color name="Help.list.fg" default="true"/>
	<color name="Help.list.bg" default="true"/>
	<color name="Help.list.selection.bg" default="true"/>
	<color name="Help.list.selection.fg" default="true"/>
	 <font name="Help.list" fontname="SansSerif" pointsize="16"/>
	<!-- Help -->

	<!-- Support -->
	<color name="Support.panel.fg" copy="white"/>
	<color name="Support.panel.bg" default="true"/>
	<color name="Support.label.fg" copy="primaryfont"/>
	<color name="Support.label.bg" default="true"/>
	 <font name="Support.label" fontname="SansSerif" pointsize="24"/>	<color name="Support.htmlarea.fg" default="true"/>
	<color name="Support.htmlarea.bg" copy="white"/>
	 <font name="Support.htmlarea" fontname="SansSerif" pointsize="18"/>
	<color name="Support.textarea.fg" copy="black"/>
	<color name="Support.textarea.bg" copy="white"/>
	<color name="Support.textarea.error.bg" copy="primarywidget.error"/>